[
  {"id":1,"itemName":"Black Nike Backpack","category":"Bags","description":"Black Nike Backpack - backpack with laptop compartment. Lost on 10/29/2024.","location":"Library 3rd Floor","dateLost":"2024-10-29","contactName":"CCIS Student","contactEmail":"admin@ccis.edu","contactPhone":"(555) 123-4567","status":"resolved","reportedBy":"admin@ccis.edu","reportedById":1,"reportedAt":"2024-10-29T00:00:00.000Z","updatedAt":"2024-10-29T00:00:00.000Z"},
  {"id":2,"itemName":"Blue Adidas Phone","category":"Electronics","description":"Blue Adidas Phone - smartphone with protective case. Lost on 8/30/2024.","location":"Student Center Food Court","dateLost":"2024-08-30","contactName":"CCIS Student","contactEmail":"admin@ccis.edu","contactPhone":"(555) 123-4567","status":"claimed","reportedBy":"admin@ccis.edu","reportedById":1,"reportedAt":"2024-08-30T00:00:00.000Z","updatedAt":"2024-08-30T00:00:00.000Z"},
  {"id":3,"itemName":"Red Keys","category":"Keys","description":"Red Keys - key ring with multiple keys. Lost on 10/13/2024.","location":"Parking Lot B","dateLost":"2024-10-13","contactName":"CCIS Student","contactEmail":"admin@ccis.edu","contactPhone":"(555) 123-4567","status":"resolved","reportedBy":"admin@ccis.edu","reportedById":1,"reportedAt":"2024-10-13T00:00:00.000Z","updatedAt":"2024-10-13T00:00:00.000Z"},
  {"id":4,"itemName":"Gray Samsung Laptop","category":"Electronics","description":"Gray Samsung Laptop - laptop computer. Lost on 9/27/2024.","location":"West Hall Room 205","dateLost":"2024-09-27","contactName":"CCIS Student","contactEmail":"admin@ccis.edu","contactPhone":"(555) 123-4567","status":"claimed","reportedBy":"admin@ccis.edu","reportedById":1,"reportedAt":"2024-09-27T00:00:00.000Z","updatedAt":"2024-09-27T00:00:00.000Z"},
  {"id":5,"itemName":"Navy Wallet","category":"Accessories","description":"Navy Wallet - leather wallet. Lost on 9/11/2024.","location":"Science Building Lab 3","dateLost":"2024-09-11","contactName":"CCIS Student","contactEmail":"admin@ccis.edu","contactPhone":"(555) 123-4567","status":"resolved","reportedBy":"admin@ccis.edu","reportedById":1,"reportedAt":"2024-09-11T00:00:00.000Z","updatedAt":"2024-09-11T00:00:00.000Z"},
  {"id":6,"itemName":"Green JanSport Water Bottle","category":"Accessories","description":"Green JanSport Water Bottle - reusable water bottle. Lost on 10/22/2024.","location":"Gym Locker Room","dateLost":"2024-10-22","contactName":"CCIS Student","contactEmail":"admin@ccis.edu","contactPhone":"(555) 123-4567","status":"claimed","reportedBy":"admin@ccis.edu","reportedById":1,"reportedAt":"2024-10-22T00:00:00.000Z","updatedAt":"2024-10-22T00:00:00.000Z"},
  {"id":7,"itemName":"Purple North Face Textbook","category":"Books","description":"Purple North Face Textbook - course textbook. Lost on 9/6/2024.","location":"East Hall Cafeteria","dateLost":"2024-09-06","contactName":"CCIS Student","contactEmail":"admin@ccis.edu","contactPhone":"(555) 123-4567","status":"resolved","reportedBy":"admin@ccis.edu","reportedById":1,"reportedAt":"2024-09-06T00:00:00.000Z","updatedAt":"2024-09-06T00:00:00.000Z"},
  {"id":8,"itemName":"Brown Sony Jacket","category":"Clothing","description":"Brown Sony Jacket - jacket or coat. Lost on 10/17/2024.","location":"Computer Lab A","dateLost":"2024-10-17","contactName":"CCIS Student","contactEmail":"admin@ccis.edu","contactPhone":"(555) 123-4567","status":"claimed","reportedBy":"admin@ccis.edu","reportedById":1,"reportedAt":"2024-10-17T00:00:00.000Z","updatedAt":"2024-10-17T00:00:00.000Z"},
  {"id":9,"itemName":"White Dell Headphones","category":"Electronics","description":"White Dell Headphones - wireless headphones. Lost on 10/1/2024.","location":"Main Entrance","dateLost":"2024-10-01","contactName":"CCIS Student","contactEmail":"admin@ccis.edu","contactPhone":"(555) 123-4567","status":"resolved","reportedBy":"admin@ccis.edu","reportedById":1,"reportedAt":"2024-10-01T00:00:00.000Z","updatedAt":"2024-10-01T00:00:00.000Z"},
  {"id":10,"itemName":"Silver Umbrella","category":"Accessories","description":"Silver Umbrella - folding umbrella. Lost on 9/15/2024.","location":"Auditorium","dateLost":"2024-09-15","contactName":"CCIS Student","contactEmail":"admin@ccis.edu","contactPhone":"(555) 123-4567","status":"claimed","reportedBy":"admin@ccis.edu","reportedById":1,"reportedAt":"2024-09-15T00:00:00.000Z","updatedAt":"2024-09-15T00:00:00.000Z"},
  {"id":11,"itemName":"Black Nike ID Card","category":"Documents","description":"Black Nike ID Card - student ID card. Lost on 10/26/2024.","location":"North Campus Park","dateLost":"2024-10-26","contactName":"CCIS Student","contactEmail":"admin@ccis.edu","contactPhone":"(555) 123-4567","status":"resolved","reportedBy":"admin@ccis.edu","reportedById":1,"reportedAt":"2024-10-26T00:00:00.000Z","updatedAt":"2024-10-26T00:00:00.000Z"},
  {"id":12,"itemName":"Blue Adidas Calculator","category":"Electronics","description":"Blue Adidas Calculator - scientific calculator. Lost on 9/10/2024.","location":"Bus Stop Area","dateLost":"2024-09-10","contactName":"CCIS Student","contactEmail":"admin@ccis.edu","contactPhone":"(555) 123-4567","status":"claimed","reportedBy":"admin@ccis.edu","reportedById":1,"reportedAt":"2024-09-10T00:00:00.000Z","updatedAt":"2024-09-10T00:00:00.000Z"},
  {"id":13,"itemName":"Red Apple Watch","category":"Accessories","description":"Red Apple Watch - wrist watch. Lost on 10/21/2024.","location":"Library 1st Floor","dateLost":"2024-10-21","contactName":"CCIS Student","contactEmail":"admin@ccis.edu","contactPhone":"(555) 123-4567","status":"resolved","reportedBy":"admin@ccis.edu","reportedById":1,"reportedAt":"2024-10-21T00:00:00.000Z","updatedAt":"2024-10-21T00:00:00.000Z"},
  {"id":14,"itemName":"Gray Samsung Notebook","category":"Books","description":"Gray Samsung Notebook - spiral notebook. Lost on 9/5/2024.","location":"Student Lounge","dateLost":"2024-09-05","contactName":"CCIS Student","contactEmail":"admin@ccis.edu","contactPhone":"(555) 123-4567","status":"claimed","reportedBy":"admin@ccis.edu","reportedById":1,"reportedAt":"2024-09-05T00:00:00.000Z","updatedAt":"2024-09-05T00:00:00.000Z"},
  {"id":15,"itemName":"Navy USB Drive","category":"Electronics","description":"Navy USB Drive - USB flash drive. Lost on 10/16/2024.","location":"Bookstore","dateLost":"2024-10-16","contactName":"CCIS Student","contactEmail":"admin@ccis.edu","contactPhone":"(555) 123-4567","status":"resolved","reportedBy":"admin@ccis.edu","reportedById":1,"reportedAt":"2024-10-16T00:00:00.000Z","updatedAt":"2024-10-16T00:00:00.000Z"},
  {"id":16,"itemName":"Green JanSport Glasses","category":"Accessories","description":"Green JanSport Glasses - prescription glasses or sunglasses. Lost on 8/31/2024.","location":"Recreation Center","dateLost":"2024-08-31","contactName":"CCIS Student","contactEmail":"admin@ccis.edu","contactPhone":"(555) 123-4567","status":"claimed","reportedBy":"admin@ccis.edu","reportedById":1,"reportedAt":"2024-08-31T00:00:00.000Z","updatedAt":"2024-08-31T00:00:00.000Z"},
  {"id":17,"itemName":"Purple North Face Charger","category":"Electronics","description":"Purple North Face Charger - phone or laptop charger. Lost on 10/11/2024.","location":"Library 3rd Floor","dateLost":"2024-10-11","contactName":"CCIS Student","contactEmail":"admin@ccis.edu","contactPhone":"(555) 123-4567","status":"resolved","reportedBy":"admin@ccis.edu","reportedById":1,"reportedAt":"2024-10-11T00:00:00.000Z","updatedAt":"2024-10-11T00:00:00.000Z"},
  {"id":18,"itemName":"Brown Sony Hoodie","category":"Clothing","description":"Brown Sony Hoodie - hooded sweatshirt. Lost on 9/25/2024.","location":"Student Center Food Court","dateLost":"2024-09-25","contactName":"CCIS Student","contactEmail":"admin@ccis.edu","contactPhone":"(555) 123-4567","status":"claimed","reportedBy":"admin@ccis.edu","reportedById":1,"reportedAt":"2024-09-25T00:00:00.000Z","updatedAt":"2024-09-25T00:00:00.000Z"},
  {"id":19,"itemName":"White Dell Scarf","category":"Clothing","description":"White Dell Scarf - winter scarf. Lost on 9/9/2024.","location":"Parking Lot B","dateLost":"2024-09-09","contactName":"CCIS Student","contactEmail":"admin@ccis.edu","contactPhone":"(555) 123-4567","status":"resolved","reportedBy":"admin@ccis.edu","reportedById":1,"reportedAt":"2024-09-09T00:00:00.000Z","updatedAt":"2024-09-09T00:00:00.000Z"},
  {"id":20,"itemName":"Silver Hat","category":"Clothing","description":"Silver Hat - baseball cap or beanie. Lost on 10/20/2024.","location":"West Hall Room 205","dateLost":"2024-10-20","contactName":"CCIS Student","contactEmail":"admin@ccis.edu","contactPhone":"(555) 123-4567","status":"claimed","reportedBy":"admin@ccis.edu","reportedById":1,"reportedAt":"2024-10-20T00:00:00.000Z","updatedAt":"2024-10-20T00:00:00.000Z"},
  {"id":21,"itemName":"Black Nike Earbuds","category":"Electronics","description":"Black Nike Earbuds - wireless earbuds with case. Lost on 9/4/2024.","location":"Science Building Lab 3","dateLost":"2024-09-04","contactName":"CCIS Student","contactEmail":"admin@ccis.edu","contactPhone":"(555) 123-4567","status":"resolved","reportedBy":"admin@ccis.edu","reportedById":1,"reportedAt":"2024-09-04T00:00:00.000Z","updatedAt":"2024-09-04T00:00:00.000Z"},
  {"id":22,"itemName":"Blue Adidas Lunchbox","category":"Accessories","description":"Blue Adidas Lunchbox - insulated lunch container. Lost on 10/15/2024.","location":"Gym Locker Room","dateLost":"2024-10-15","contactName":"CCIS Student","contactEmail":"admin@ccis.edu","contactPhone":"(555) 123-4567","status":"claimed","reportedBy":"admin@ccis.edu","reportedById":1,"reportedAt":"2024-10-15T00:00:00.000Z","updatedAt":"2024-10-15T00:00:00.000Z"},
  {"id":23,"itemName":"Red Badge","category":"Documents","description":"Red Badge - access badge or ID. Lost on 8/29/2024.","location":"East Hall Cafeteria","dateLost":"2024-08-29","contactName":"CCIS Student","contactEmail":"admin@ccis.edu","contactPhone":"(555) 123-4567","status":"resolved","reportedBy":"admin@ccis.edu","reportedById":1,"reportedAt":"2024-08-29T00:00:00.000Z","updatedAt":"2024-08-29T00:00:00.000Z"},
  {"id":24,"itemName":"Gray Samsung Mouse","category":"Electronics","description":"Gray Samsung Mouse - wireless computer mouse. Lost on 10/10/2024.","location":"Computer Lab A","dateLost":"2024-10-10","contactName":"CCIS Student","contactEmail":"admin@ccis.edu","contactPhone":"(555) 123-4567","status":"claimed","reportedBy":"admin@ccis.edu","reportedById":1,"reportedAt":"2024-10-10T00:00:00.000Z","updatedAt":"2024-10-10T00:00:00.000Z"},
  {"id":25,"itemName":"Navy Planner","category":"Books","description":"Navy Planner - daily planner or agenda. Lost on 9/24/2024.","location":"Main Entrance","dateLost":"2024-09-24","contactName":"CCIS Student","contactEmail":"admin@ccis.edu","contactPhone":"(555) 123-4567","status":"resolved","reportedBy":"admin@ccis.edu","reportedById":1,"reportedAt":"2024-09-24T00:00:00.000Z","updatedAt":"2024-09-24T00:00:00.000Z"},
  {"id":26,"itemName":"Green JanSport Backpack","category":"Bags","description":"Green JanSport Backpack - backpack with laptop compartment. Lost on 9/8/2024.","location":"Auditorium","dateLost":"2024-09-08","contactName":"CCIS Student","contactEmail":"admin@ccis.edu","contactPhone":"(555) 123-4567","status":"claimed","reportedBy":"admin@ccis.edu","reportedById":1,"reportedAt":"2024-09-08T00:00:00.000Z","updatedAt":"2024-09-08T00:00:00.000Z"},
  {"id":27,"itemName":"Purple North Face Phone","category":"Electronics","description":"Purple North Face Phone - smartphone with protective case. Lost on 10/19/2024.","location":"North Campus Park","dateLost":"2024-10-19","contactName":"CCIS Student","contactEmail":"admin@ccis.edu","contactPhone":"(555) 123-4567","status":"resolved","reportedBy":"admin@ccis.edu","reportedById":1,"reportedAt":"2024-10-19T00:00:00.000Z","updatedAt":"2024-10-19T00:00:00.000Z"},
  {"id":28,"itemName":"Brown Sony Keys","category":"Keys","description":"Brown Sony Keys - key ring with multiple keys. Lost on 9/3/2024.","location":"Bus Stop Area","dateLost":"2024-09-03","contactName":"CCIS Student","contactEmail":"admin@ccis.edu","contactPhone":"(555) 123-4567","status":"claimed","reportedBy":"admin@ccis.edu","reportedById":1,"reportedAt":"2024-09-03T00:00:00.000Z","updatedAt":"2024-09-03T00:00:00.000Z"},
  {"id":29,"itemName":"White Dell Laptop","category":"Electronics","description":"White Dell Laptop - laptop computer. Lost on 10/14/2024.","location":"Library 1st Floor","dateLost":"2024-10-14","contactName":"CCIS Student","contactEmail":"admin@ccis.edu","contactPhone":"(555) 123-4567","status":"resolved","reportedBy":"admin@ccis.edu","reportedById":1,"reportedAt":"2024-10-14T00:00:00.000Z","updatedAt":"2024-10-14T00:00:00.000Z"},
  {"id":30,"itemName":"Silver Wallet","category":"Accessories","description":"Silver Wallet - leather wallet. Lost on 8/28/2024.","location":"Student Lounge","dateLost":"2024-08-28","contactName":"CCIS Student","contactEmail":"admin@ccis.edu","contactPhone":"(555) 123-4567","status":"claimed","reportedBy":"admin@ccis.edu","reportedById":1,"reportedAt":"2024-08-28T00:00:00.000Z","updatedAt":"2024-08-28T00:00:00.000Z"},
  {"id":31,"itemName":"Black Nike Water Bottle","category":"Accessories","description":"Black Nike Water Bottle - reusable water bottle. Lost on 10/9/2024.","location":"Bookstore","dateLost":"2024-10-9","contactName":"CCIS Student","contactEmail":"admin@ccis.edu","contactPhone":"(555) 123-4567","status":"resolved","reportedBy":"admin@ccis.edu","reportedById":1,"reportedAt":"2024-10-09T00:00:00.000Z","updatedAt":"2024-10-09T00:00:00.000Z"},
  {"id":32,"itemName":"Blue Adidas Textbook","category":"Books","description":"Blue Adidas Textbook - course textbook. Lost on 9/23/2024.","location":"Recreation Center","dateLost":"2024-09-23","contactName":"CCIS Student","contactEmail":"admin@ccis.edu","contactPhone":"(555) 123-4567","status":"claimed","reportedBy":"admin@ccis.edu","reportedById":1,"reportedAt":"2024-09-23T00:00:00.000Z","updatedAt":"2024-09-23T00:00:00.000Z"},
  {"id":33,"itemName":"Red Jacket","category":"Clothing","description":"Red Jacket - jacket or coat. Lost on 9/7/2024.","location":"Library 3rd Floor","dateLost":"2024-09-07","contactName":"CCIS Student","contactEmail":"admin@ccis.edu","contactPhone":"(555) 123-4567","status":"resolved","reportedBy":"admin@ccis.edu","reportedById":1,"reportedAt":"2024-09-07T00:00:00.000Z","updatedAt":"2024-09-07T00:00:00.000Z"},
  {"id":34,"itemName":"Gray Samsung Headphones","category":"Electronics","description":"Gray Samsung Headphones - wireless headphones. Lost on 10/18/2024.","location":"Student Center Food Court","dateLost":"2024-10-18","contactName":"CCIS Student","contactEmail":"admin@ccis.edu","contactPhone":"(555) 123-4567","status":"claimed","reportedBy":"admin@ccis.edu","reportedById":1,"reportedAt":"2024-10-18T00:00:00.000Z","updatedAt":"2024-10-18T00:00:00.000Z"},
  {"id":35,"itemName":"Navy Umbrella","category":"Accessories","description":"Navy Umbrella - folding umbrella. Lost on 9/2/2024.","location":"Parking Lot B","dateLost":"2024-09-02","contactName":"CCIS Student","contactEmail":"admin@ccis.edu","contactPhone":"(555) 123-4567","status":"resolved","reportedBy":"admin@ccis.edu","reportedById":1,"reportedAt":"2024-09-02T00:00:00.000Z","updatedAt":"2024-09-02T00:00:00.000Z"},
  {"id":36,"itemName":"Green JanSport ID Card","category":"Documents","description":"Green JanSport ID Card - student ID card. Lost on 10/13/2024.","location":"West Hall Room 205","dateLost":"2024-10-13","contactName":"CCIS Student","contactEmail":"admin@ccis.edu","contactPhone":"(555) 123-4567","status":"claimed","reportedBy":"admin@ccis.edu","reportedById":1,"reportedAt":"2024-10-13T00:00:00.000Z","updatedAt":"2024-10-13T00:00:00.000Z"},
  {"id":37,"itemName":"Purple North Face Calculator","category":"Electronics","description":"Purple North Face Calculator - scientific calculator. Lost on 8/27/2024.","location":"Science Building Lab 3","dateLost":"2024-08-27","contactName":"CCIS Student","contactEmail":"admin@ccis.edu","contactPhone":"(555) 123-4567","status":"resolved","reportedBy":"admin@ccis.edu","reportedById":1,"reportedAt":"2024-08-27T00:00:00.000Z","updatedAt":"2024-08-27T00:00:00.000Z"},
  {"id":38,"itemName":"Brown Sony Watch","category":"Accessories","description":"Brown Sony Watch - wrist watch. Lost on 10/8/2024.","location":"Gym Locker Room","dateLost":"2024-10-8","contactName":"CCIS Student","contactEmail":"admin@ccis.edu","contactPhone":"(555) 123-4567","status":"claimed","reportedBy":"admin@ccis.edu","reportedById":1,"reportedAt":"2024-10-08T00:00:00.000Z","updatedAt":"2024-10-08T00:00:00.000Z"},
  {"id":39,"itemName":"White Dell Notebook","category":"Books","description":"White Dell Notebook - spiral notebook. Lost on 9/22/2024.","location":"East Hall Cafeteria","dateLost":"2024-09-22","contactName":"CCIS Student","contactEmail":"admin@ccis.edu","contactPhone":"(555) 123-4567","status":"resolved","reportedBy":"admin@ccis.edu","reportedById":1,"reportedAt":"2024-09-22T00:00:00.000Z","updatedAt":"2024-09-22T00:00:00.000Z"},
  {"id":40,"itemName":"Silver USB Drive","category":"Electronics","description":"Silver USB Drive - USB flash drive. Lost on 9/6/2024.","location":"Computer Lab A","dateLost":"2024-09-06","contactName":"CCIS Student","contactEmail":"admin@ccis.edu","contactPhone":"(555) 123-4567","status":"claimed","reportedBy":"admin@ccis.edu","reportedById":1,"reportedAt":"2024-09-06T00:00:00.000Z","updatedAt":"2024-09-06T00:00:00.000Z"},
  {"id":41,"itemName":"Black Nike Glasses","category":"Accessories","description":"Black Nike Glasses - prescription glasses or sunglasses. Lost on 10/17/2024.","location":"Main Entrance","dateLost":"2024-10-17","contactName":"CCIS Student","contactEmail":"admin@ccis.edu","contactPhone":"(555) 123-4567","status":"resolved","reportedBy":"admin@ccis.edu","reportedById":1,"reportedAt":"2024-10-17T00:00:00.000Z","updatedAt":"2024-10-17T00:00:00.000Z"},
  {"id":42,"itemName":"Blue Adidas Charger","category":"Electronics","description":"Blue Adidas Charger - phone or laptop charger. Lost on 9/1/2024.","location":"Auditorium","dateLost":"2024-09-01","contactName":"CCIS Student","contactEmail":"admin@ccis.edu","contactPhone":"(555) 123-4567","status":"claimed","reportedBy":"admin@ccis.edu","reportedById":1,"reportedAt":"2024-09-01T00:00:00.000Z","updatedAt":"2024-09-01T00:00:00.000Z"},
  {"id":43,"itemName":"Red Hoodie","category":"Clothing","description":"Red Hoodie - hooded sweatshirt. Lost on 10/12/2024.","location":"North Campus Park","dateLost":"2024-10-12","contactName":"CCIS Student","contactEmail":"admin@ccis.edu","contactPhone":"(555) 123-4567","status":"resolved","reportedBy":"admin@ccis.edu","reportedById":1,"reportedAt":"2024-10-12T00:00:00.000Z","updatedAt":"2024-10-12T00:00:00.000Z"},
  {"id":44,"itemName":"Gray Samsung Scarf","category":"Clothing","description":"Gray Samsung Scarf - winter scarf. Lost on 8/26/2024.","location":"Bus Stop Area","dateLost":"2024-08-26","contactName":"CCIS Student","contactEmail":"admin@ccis.edu","contactPhone":"(555) 123-4567","status":"claimed","reportedBy":"admin@ccis.edu","reportedById":1,"reportedAt":"2024-08-26T00:00:00.000Z","updatedAt":"2024-08-26T00:00:00.000Z"},
  {"id":45,"itemName":"Navy Hat","category":"Clothing","description":"Navy Hat - baseball cap or beanie. Lost on 10/7/2024.","location":"Library 1st Floor","dateLost":"2024-10-07","contactName":"CCIS Student","contactEmail":"admin@ccis.edu","contactPhone":"(555) 123-4567","status":"resolved","reportedBy":"admin@ccis.edu","reportedById":1,"reportedAt":"2024-10-07T00:00:00.000Z","updatedAt":"2024-10-07T00:00:00.000Z"},
  {"id":46,"itemName":"Green JanSport Earbuds","category":"Electronics","description":"Green JanSport Earbuds - wireless earbuds with case. Lost on 9/21/2024.","location":"Student Lounge","dateLost":"2024-09-21","contactName":"CCIS Student","contactEmail":"admin@ccis.edu","contactPhone":"(555) 123-4567","status":"claimed","reportedBy":"admin@ccis.edu","reportedById":1,"reportedAt":"2024-09-21T00:00:00.000Z","updatedAt":"2024-09-21T00:00:00.000Z"},
  {"id":47,"itemName":"Purple North Face Lunchbox","category":"Accessories","description":"Purple North Face Lunchbox - insulated lunch container. Lost on 9/5/2024.","location":"Bookstore","dateLost":"2024-09-05","contactName":"CCIS Student","contactEmail":"admin@ccis.edu","contactPhone":"(555) 123-4567","status":"resolved","reportedBy":"admin@ccis.edu","reportedById":1,"reportedAt":"2024-09-05T00:00:00.000Z","updatedAt":"2024-09-05T00:00:00.000Z"},
  {"id":48,"itemName":"Brown Sony Badge","category":"Documents","description":"Brown Sony Badge - access badge or ID. Lost on 10/16/2024.","location":"Recreation Center","dateLost":"2024-10-16","contactName":"CCIS Student","contactEmail":"admin@ccis.edu","contactPhone":"(555) 123-4567","status":"claimed","reportedBy":"admin@ccis.edu","reportedById":1,"reportedAt":"2024-10-16T00:00:00.000Z","updatedAt":"2024-10-16T00:00:00.000Z"},
  {"id":49,"itemName":"White Dell Mouse","category":"Electronics","description":"White Dell Mouse - wireless computer mouse. Lost on 8/31/2024.","location":"Library 3rd Floor","dateLost":"2024-08-31","contactName":"CCIS Student","contactEmail":"admin@ccis.edu","contactPhone":"(555) 123-4567","status":"resolved","reportedBy":"admin@ccis.edu","reportedById":1,"reportedAt":"2024-08-31T00:00:00.000Z","updatedAt":"2024-08-31T00:00:00.000Z"},
  {"id":50,"itemName":"Silver Planner","category":"Books","description":"Silver Planner - daily planner or agenda. Lost on 10/11/2024.","location":"Student Center Food Court","dateLost":"2024-10-11","contactName":"CCIS Student","contactEmail":"admin@ccis.edu","contactPhone":"(555) 123-4567","status":"claimed","reportedBy":"admin@ccis.edu","reportedById":1,"reportedAt":"2024-10-11T00:00:00.000Z","updatedAt":"2024-10-11T00:00:00.000Z"}
]